{
  "$schema": "product-skill.schema.json",
  "id": "ai-search",
  "version": "1.0.0",
  "name": "AI & search",
  "instructions": "Analyze Azure AI and Search endpoints, managed identity, private networking, model deployment compatibility, quotas and observability.",
  "reference": "https://learn.microsoft.com/azure/ai-services/what-are-ai-services",
  "intentKeywords": ["openai", "ai service", "machine learning", "search", "model deployment"],
  "resourceTypes": [],
  "resourceTypePrefixes": [
    "microsoft.cognitiveservices/",
    "microsoft.machinelearningservices/",
    "microsoft.search/"
  ]
}